{
  "schema_version": "1.0",
  "entity": "perspective_story_artwork_catalog",
  "language": "vi",
  "themes": [
    {
      "theme_id": "adversity_resilience",
      "file_id": "story_artwork.adversity_resilience.v2",
      "alt_text_vi": "Cây cổ thụ bám rễ giữa vách đá khi mây giông đang nhường chỗ cho bình minh"
    },
    {
      "theme_id": "attention",
      "file_id": "story_artwork.attention.v1",
      "alt_text_vi": "Giọt sương trong veo trên lá cỏ bên mặt hồ tĩnh lặng lúc bình minh"
    },
    {
      "theme_id": "change_growth",
      "file_id": "story_artwork.change_growth.v1",
      "alt_text_vi": "Mầm cây non vươn lên từ lớp đất ẩm sau cơn mưa"
    },
    {
      "theme_id": "emotion",
      "file_id": "story_artwork.emotion.v1",
      "alt_text_vi": "Những lớp màu nước xanh, tím và hồng chuyển động trên mặt hồ"
    },
    {
      "theme_id": "meaning_values",
      "file_id": "story_artwork.meaning_values.v2",
      "alt_text_vi": "Chồng đá cân bằng nhìn ra những con đường rẽ qua thung lũng phủ sương"
    },
    {
      "theme_id": "relationships",
      "file_id": "story_artwork.relationships.v1",
      "alt_text_vi": "Hai dòng suối khác màu gặp nhau quanh một tảng đá rồi cùng chảy về phía trước"
    },
    {
      "theme_id": "rest_wellbeing",
      "file_id": "story_artwork.rest_wellbeing.v1",
      "alt_text_vi": "Hồ sen yên tĩnh dưới ánh trăng và những dãy núi phủ sương"
    },
    {
      "theme_id": "self_understanding",
      "file_id": "story_artwork.self_understanding.v1",
      "alt_text_vi": "Vũng nước trong giữa những phiến đá phản chiếu bầu trời rộng"
    },
    {
      "theme_id": "work_achievement",
      "file_id": "story_artwork.work_achievement.v1",
      "alt_text_vi": "Những phiến đá bước qua dòng suối dẫn dần tới cổng đá trên đồi sáng"
    }
  ]
}
